评论ID,昵称,地区,时间,评论,点赞数
7480322720539231014,长矛沾屎戳谁谁死  水瓶装尿呲谁谁叫,福建,2025-03-11 07:12:44,"谁懂啊
毫无欲望的一堵墙",11
7480373749487125283,不换,海南,2025-03-11 10:30:47,过期之前喊我去你家可以吗,0
7480167895684023097,a 嘉楠 a,内蒙古,2025-03-10 21:11:48,客厅飘窗下面的抽屉里还有几十盒面膜，二十多个洗面奶，口红二十多个，唇膏十来个，精华液，精油洗发水护发素各十几瓶，两个卫生间柜子里抽屉里都是护肤品[泪奔]卫生巾几十包[泪奔]，还有过期的精华放茶几上当护手霜[泪奔]没穿过的新鞋四十多双，衣服更数不清[尬笑],6
7480358874639270683,饼干小姐🍪,海南,2025-03-11 09:33:02,要不你给我邮点 邮费我自付 不然太可惜了[捂脸],0
7480160776440693555,90岁冷艳美蟑螂,四川,2025-03-10 20:44:13,我不一样，就跟饕餮一样，不管买了多少一会儿就吃完了，本来打算攒着吃的[憨笑][憨笑],4
